[
  {"entity_id":"vendor-alpha","category":"cyber","risk_score":77.0,"run_id":0,"entity_name":"Vendor Alpha","entity_type":"vendor","agent_id":"synthetic-example","metadata":{"synthetic":true}},
  {"entity_id":"vendor-alpha","category":"cyber","risk_score":76.8,"run_id":1},
  {"entity_id":"vendor-alpha","category":"cyber","risk_score":77.2,"run_id":2},
  {"entity_id":"vendor-alpha","category":"cyber","risk_score":82.9,"run_id":3},
  {"entity_id":"vendor-alpha","category":"cyber","risk_score":77.1,"run_id":4},
  {"entity_id":"vendor-alpha","category":"cyber","risk_score":67.5,"run_id":5},
  {"entity_id":"vendor-alpha","category":"cyber","risk_score":80.3,"run_id":6},
  {"entity_id":"vendor-alpha","category":"cyber","risk_score":76.1,"run_id":7},
  {"entity_id":"vendor-alpha","category":"cyber","risk_score":76.5,"run_id":8},
  {"entity_id":"vendor-alpha","category":"cyber","risk_score":78.8,"run_id":9},
  {"entity_id":"vendor-alpha","category":"cyber","risk_score":79.6,"run_id":10},
  {"entity_id":"vendor-alpha","category":"cyber","risk_score":86.1,"run_id":11},
  {"entity_id":"vendor-alpha","category":"cyber","risk_score":82.6,"run_id":12},
  {"entity_id":"vendor-alpha","category":"cyber","risk_score":78.8,"run_id":13},
  {"entity_id":"vendor-alpha","category":"cyber","risk_score":72.8,"run_id":14},
  {"entity_id":"vendor-alpha","category":"cyber","risk_score":70.9,"run_id":15},
  {"entity_id":"vendor-alpha","category":"cyber","risk_score":79.7,"run_id":16},
  {"entity_id":"vendor-alpha","category":"cyber","risk_score":87.2,"run_id":17},
  {"entity_id":"vendor-alpha","category":"cyber","risk_score":78.3,"run_id":18},
  {"entity_id":"vendor-alpha","category":"cyber","risk_score":77.3,"run_id":19},
  {"entity_id":"vendor-alpha","category":"cyber","risk_score":81.7,"run_id":20},
  {"entity_id":"vendor-alpha","category":"cyber","risk_score":67.8,"run_id":21},
  {"entity_id":"vendor-alpha","category":"cyber","risk_score":75.8,"run_id":22},
  {"entity_id":"vendor-alpha","category":"cyber","risk_score":81.4,"run_id":23},
  {"entity_id":"vendor-alpha","category":"cyber","risk_score":84.1,"run_id":24},
  {"entity_id":"vendor-alpha","category":"cyber","risk_score":76.3,"run_id":25},
  {"entity_id":"vendor-alpha","category":"cyber","risk_score":80.6,"run_id":26},
  {"entity_id":"vendor-alpha","category":"cyber","risk_score":79.7,"run_id":27},
  {"entity_id":"vendor-alpha","category":"cyber","risk_score":83.5,"run_id":28},
  {"entity_id":"vendor-alpha","category":"cyber","risk_score":70.2,"run_id":29},
  {"entity_id":"vendor-alpha","category":"financial","risk_score":30.8,"run_id":0,"entity_name":"Vendor Alpha","entity_type":"vendor","agent_id":"synthetic-example","metadata":{"synthetic":true}},
  {"entity_id":"vendor-alpha","category":"financial","risk_score":20.4,"run_id":1},
  {"entity_id":"vendor-alpha","category":"financial","risk_score":14.9,"run_id":2},
  {"entity_id":"vendor-alpha","category":"financial","risk_score":25.0,"run_id":3},
  {"entity_id":"vendor-alpha","category":"financial","risk_score":23.4,"run_id":4},
  {"entity_id":"vendor-alpha","category":"financial","risk_score":32.4,"run_id":5},
  {"entity_id":"vendor-alpha","category":"financial","risk_score":31.3,"run_id":6},
  {"entity_id":"vendor-alpha","category":"financial","risk_score":21.9,"run_id":7},
  {"entity_id":"vendor-alpha","category":"financial","risk_score":32.2,"run_id":8},
  {"entity_id":"vendor-alpha","category":"financial","risk_score":23.0,"run_id":9},
  {"entity_id":"vendor-alpha","category":"financial","risk_score":27.6,"run_id":10},
  {"entity_id":"vendor-alpha","category":"financial","risk_score":26.5,"run_id":11},
  {"entity_id":"vendor-alpha","category":"financial","risk_score":28.6,"run_id":12},
  {"entity_id":"vendor-alpha","category":"financial","risk_score":32.1,"run_id":13},
  {"entity_id":"vendor-alpha","category":"financial","risk_score":31.2,"run_id":14},
  {"entity_id":"vendor-alpha","category":"financial","risk_score":29.7,"run_id":15},
  {"entity_id":"vendor-alpha","category":"financial","risk_score":31.2,"run_id":16},
  {"entity_id":"vendor-alpha","category":"financial","risk_score":30.4,"run_id":17},
  {"entity_id":"vendor-alpha","category":"financial","risk_score":24.9,"run_id":18},
  {"entity_id":"vendor-alpha","category":"financial","risk_score":24.4,"run_id":19},
  {"entity_id":"vendor-alpha","category":"financial","risk_score":25.7,"run_id":20},
  {"entity_id":"vendor-alpha","category":"financial","risk_score":30.5,"run_id":21},
  {"entity_id":"vendor-alpha","category":"financial","risk_score":26.7,"run_id":22},
  {"entity_id":"vendor-alpha","category":"financial","risk_score":39.7,"run_id":23},
  {"entity_id":"vendor-alpha","category":"financial","risk_score":23.9,"run_id":24},
  {"entity_id":"vendor-alpha","category":"financial","risk_score":22.5,"run_id":25},
  {"entity_id":"vendor-alpha","category":"financial","risk_score":31.8,"run_id":26},
  {"entity_id":"vendor-alpha","category":"financial","risk_score":35.1,"run_id":27},
  {"entity_id":"vendor-alpha","category":"financial","risk_score":30.5,"run_id":28},
  {"entity_id":"vendor-alpha","category":"financial","risk_score":32.2,"run_id":29},
  {"entity_id":"vendor-alpha","category":"operational","risk_score":62.8,"run_id":0,"entity_name":"Vendor Alpha","entity_type":"vendor","agent_id":"synthetic-example","metadata":{"synthetic":true}},
  {"entity_id":"vendor-alpha","category":"operational","risk_score":49.2,"run_id":1},
  {"entity_id":"vendor-alpha","category":"operational","risk_score":37.2,"run_id":2},
  {"entity_id":"vendor-alpha","category":"operational","risk_score":45.2,"run_id":3},
  {"entity_id":"vendor-alpha","category":"operational","risk_score":58.6,"run_id":4},
  {"entity_id":"vendor-alpha","category":"operational","risk_score":37.0,"run_id":5},
  {"entity_id":"vendor-alpha","category":"operational","risk_score":50.3,"run_id":6},
  {"entity_id":"vendor-alpha","category":"operational","risk_score":52.3,"run_id":7},
  {"entity_id":"vendor-alpha","category":"operational","risk_score":47.2,"run_id":8},
  {"entity_id":"vendor-alpha","category":"operational","risk_score":56.5,"run_id":9},
  {"entity_id":"vendor-alpha","category":"operational","risk_score":55.2,"run_id":10},
  {"entity_id":"vendor-alpha","category":"operational","risk_score":70.9,"run_id":11},
  {"entity_id":"vendor-alpha","category":"operational","risk_score":55.6,"run_id":12},
  {"entity_id":"vendor-alpha","category":"operational","risk_score":44.5,"run_id":13},
  {"entity_id":"vendor-alpha","category":"operational","risk_score":44.9,"run_id":14},
  {"entity_id":"vendor-alpha","category":"operational","risk_score":42.5,"run_id":15},
  {"entity_id":"vendor-alpha","category":"operational","risk_score":58.6,"run_id":16},
  {"entity_id":"vendor-alpha","category":"operational","risk_score":44.9,"run_id":17},
  {"entity_id":"vendor-alpha","category":"operational","risk_score":49.4,"run_id":18},
  {"entity_id":"vendor-alpha","category":"operational","risk_score":56.7,"run_id":19},
  {"entity_id":"vendor-alpha","category":"operational","risk_score":43.5,"run_id":20},
  {"entity_id":"vendor-alpha","category":"operational","risk_score":47.4,"run_id":21},
  {"entity_id":"vendor-alpha","category":"operational","risk_score":33.4,"run_id":22},
  {"entity_id":"vendor-alpha","category":"operational","risk_score":40.3,"run_id":23},
  {"entity_id":"vendor-alpha","category":"operational","risk_score":44.9,"run_id":24},
  {"entity_id":"vendor-alpha","category":"operational","risk_score":53.7,"run_id":25},
  {"entity_id":"vendor-alpha","category":"operational","risk_score":60.7,"run_id":26},
  {"entity_id":"vendor-alpha","category":"operational","risk_score":49.8,"run_id":27},
  {"entity_id":"vendor-alpha","category":"operational","risk_score":52.4,"run_id":28},
  {"entity_id":"vendor-alpha","category":"operational","risk_score":51.5,"run_id":29},
  {"entity_id":"vendor-alpha","category":"reputational","risk_score":40.5,"run_id":0,"entity_name":"Vendor Alpha","entity_type":"vendor","agent_id":"synthetic-example","metadata":{"synthetic":true}},
  {"entity_id":"vendor-alpha","category":"reputational","risk_score":39.4,"run_id":1},
  {"entity_id":"vendor-alpha","category":"reputational","risk_score":35.6,"run_id":2},
  {"entity_id":"vendor-alpha","category":"reputational","risk_score":27.9,"run_id":3},
  {"entity_id":"vendor-alpha","category":"reputational","risk_score":39.4,"run_id":4},
  {"entity_id":"vendor-alpha","category":"reputational","risk_score":36.3,"run_id":5},
  {"entity_id":"vendor-alpha","category":"reputational","risk_score":41.4,"run_id":6},
  {"entity_id":"vendor-alpha","category":"reputational","risk_score":33.8,"run_id":7},
  {"entity_id":"vendor-alpha","category":"reputational","risk_score":45.7,"run_id":8},
  {"entity_id":"vendor-alpha","category":"reputational","risk_score":31.8,"run_id":9},
  {"entity_id":"vendor-alpha","category":"reputational","risk_score":43.6,"run_id":10},
  {"entity_id":"vendor-alpha","category":"reputational","risk_score":34.7,"run_id":11},
  {"entity_id":"vendor-alpha","category":"reputational","risk_score":30.9,"run_id":12},
  {"entity_id":"vendor-alpha","category":"reputational","risk_score":27.2,"run_id":13},
  {"entity_id":"vendor-alpha","category":"reputational","risk_score":33.1,"run_id":14},
  {"entity_id":"vendor-alpha","category":"reputational","risk_score":42.5,"run_id":15},
  {"entity_id":"vendor-alpha","category":"reputational","risk_score":38.9,"run_id":16},
  {"entity_id":"vendor-alpha","category":"reputational","risk_score":38.1,"run_id":17},
  {"entity_id":"vendor-alpha","category":"reputational","risk_score":19.7,"run_id":18},
  {"entity_id":"vendor-alpha","category":"reputational","risk_score":38.3,"run_id":19},
  {"entity_id":"vendor-alpha","category":"reputational","risk_score":37.3,"run_id":20},
  {"entity_id":"vendor-alpha","category":"reputational","risk_score":30.7,"run_id":21},